{
  "$schema": "https://json-schema.org/draft/2020-12/schema",
  "$id": "urn:hak:schemas:journal-voucher:1.0",
  "title": "HAK journal-voucher exchange package v1.0",
  "description": "Gói trao đổi chứng từ kế toán tổng hợp. Số tiền và tỷ giá truyền dạng chuỗi thập phân. checksum = SHA-256 (hex thường) của JCS(payload). auth.signature = Base64(HMAC-SHA256(secret, JCS(gói bỏ trường auth.signature))).",
  "type": "object",
  "additionalProperties": false,
  "required": ["schema_version", "package_id", "event_id", "source_system", "company_code", "created_at", "document_type", "source_id", "source_version", "payload", "checksum", "auth"],
  "properties": {
    "schema_version": { "const": "1.0" },
    "package_id": { "type": "string", "minLength": 8, "maxLength": 100 },
    "event_id": { "type": "string", "minLength": 1, "maxLength": 100 },
    "source_system": { "$ref": "#/$defs/code" },
    "company_code": { "$ref": "#/$defs/code" },
    "branch_code": { "anyOf": [{ "$ref": "#/$defs/code" }, { "type": "null" }] },
    "created_at": { "type": "string", "pattern": "^\\d{4}-\\d{2}-\\d{2}T\\d{2}:\\d{2}:\\d{2}(\\.\\d{1,7})?(Z|[+-]\\d{2}:\\d{2})$" },
    "document_type": { "const": "journal-voucher" },
    "source_id": { "type": "string", "minLength": 1, "maxLength": 100 },
    "source_version": { "type": "string", "minLength": 1, "maxLength": 50 },
    "payload": {
      "type": "object",
      "additionalProperties": false,
      "required": ["vouchers"],
      "properties": {
        "vouchers": { "type": "array", "minItems": 1, "maxItems": 10000, "items": { "$ref": "#/$defs/voucher" } }
      }
    },
    "checksum": {
      "type": "object",
      "additionalProperties": false,
      "required": ["algorithm", "value"],
      "properties": {
        "algorithm": { "const": "SHA-256" },
        "value": { "type": "string", "pattern": "^[0-9a-f]{64}$" }
      }
    },
    "auth": {
      "type": "object",
      "additionalProperties": false,
      "required": ["method", "key_id", "signature"],
      "properties": {
        "method": { "const": "HMAC-SHA256" },
        "key_id": { "type": "string", "minLength": 1, "maxLength": 50 },
        "signature": { "type": "string", "pattern": "^[A-Za-z0-9+/]{43}=$" }
      }
    }
  },
  "$defs": {
    "code": { "type": "string", "pattern": "^[A-Z0-9_.-]{1,30}$" },
    "date": { "type": "string", "pattern": "^\\d{4}-\\d{2}-\\d{2}$" },
    "amount": {
      "description": "Số dương, tối đa 14 chữ số phần nguyên và 4 chữ số thập phân (giới hạn lưu trữ, docs/02 ADR-05).",
      "type": "string", "pattern": "^(0|[1-9][0-9]{0,13})(\\.[0-9]{1,4})?$"
    },
    "rate": { "type": "string", "pattern": "^(0|[1-9][0-9]{0,11})(\\.[0-9]{1,6})?$" },
    "voucher": {
      "type": "object",
      "additionalProperties": false,
      "required": ["source_id", "source_version", "voucher_type", "voucher_date", "posting_date", "description", "lines"],
      "properties": {
        "source_id": { "type": "string", "minLength": 1, "maxLength": 100 },
        "source_version": { "type": "string", "minLength": 1, "maxLength": 50 },
        "voucher_type": { "enum": ["GJ", "ADJ", "ALC", "OPB"] },
        "voucher_date": { "$ref": "#/$defs/date" },
        "posting_date": { "$ref": "#/$defs/date" },
        "description": { "type": "string", "minLength": 1, "maxLength": 500 },
        "lines": { "type": "array", "minItems": 2, "maxItems": 1000, "items": { "$ref": "#/$defs/line" } }
      }
    },
    "line": {
      "type": "object",
      "additionalProperties": false,
      "required": ["account_code", "side", "amount"],
      "properties": {
        "account_code": { "$ref": "#/$defs/code" },
        "side": { "enum": ["D", "C"] },
        "amount": { "$ref": "#/$defs/amount" },
        "partner_code": { "$ref": "#/$defs/code" },
        "description": { "type": "string", "maxLength": 500 },
        "foreign_currency": { "type": "string", "pattern": "^[A-Z]{3}$" },
        "foreign_amount": { "$ref": "#/$defs/amount" },
        "exchange_rate": { "$ref": "#/$defs/rate" }
      },
      "dependentRequired": {
        "foreign_currency": ["foreign_amount", "exchange_rate"],
        "foreign_amount": ["foreign_currency", "exchange_rate"],
        "exchange_rate": ["foreign_currency", "foreign_amount"]
      }
    }
  }
}
